{
  "mode": "standard",
  "current_iteration": 1,
  "max_iterations": 2,
  "base_reviewer_count": 2,
  "status": "approved",
  "guardrails": {
    "summary_requires_review_and_qa": true
  },
  "iterations": [
    {
      "iteration": 1,
      "timestamp": "2026-04-29T13:38:00Z",
      "routing_reason": "base_set",
      "active_reviewers": [
        "wb-integration-tester",
        "wb-code-simplifier"
      ],
      "verdicts": {
        "wb-integration-tester": {
          "agent": "wb-integration-tester",
          "status": "PASS",
          "hard_gate": true,
          "summary": "Golden path acceptance criteria are covered.",
          "issues": [],
          "test_execution": {
            "total": 4,
            "passed": 4,
            "failed": 0,
            "errored": 0,
            "duration_ms": 500
          },
          "coverage_map": [
            {
              "criterion": "The workflow state reaches `public_stage: \"summary\"` and `workflow_status: \"complete\"`.",
              "test_file": "docs/golden-path-demo/.wannabuild/review/wb-integration-tester-iter-1.json",
              "test_name": "integration evidence fixture",
              "status": "covered"
            },
            {
              "criterion": "Requirements, design, tasks, checkpoints, review verdicts, and QA summary exist.",
              "test_file": "docs/golden-path-demo/.wannabuild/review/wb-integration-tester-iter-1.json",
              "test_name": "integration evidence fixture",
              "status": "covered"
            },
            {
              "criterion": "Review verdicts are passing.",
              "test_file": "docs/golden-path-demo/.wannabuild/review/wb-integration-tester-iter-1.json",
              "test_name": "integration evidence fixture",
              "status": "covered"
            },
            {
              "criterion": "Integration tester evidence covers the acceptance criteria.",
              "test_file": "docs/golden-path-demo/.wannabuild/review/wb-integration-tester-iter-1.json",
              "test_name": "integration evidence fixture",
              "status": "covered"
            }
          ]
        },
        "wb-code-simplifier": {
          "agent": "wb-code-simplifier",
          "status": "PASS",
          "summary": "Fixture is small and readable.",
          "issues": []
        }
      },
      "pass_count": 2,
      "fail_count": 0
    }
  ]
}
