{
  "mode": "standard",
  "current_iteration": 1,
  "max_iterations": 3,
  "base_reviewer_count": 6,
  "status": "approved",
  "iterations": [
    {
      "iteration": 1,
      "timestamp": "2025-01-01T00:05:00Z",
      "active_reviewers": [
        "wb-security-reviewer",
        "wb-performance-reviewer",
        "wb-architecture-reviewer",
        "wb-testing-reviewer",
        "wb-integration-tester",
        "wb-code-simplifier"
      ],
      "verdicts": {},
      "pass_count": 6,
      "fail_count": 0,
      "routing_reason": "base_set"
    }
  ]
}
